{
  "$schema": "./surface.schema.json",
  "$comment": "Declared exported interface for every client under clients/. Validated against surface.schema.json; enforced by contract/bin/check_surface.py in tests, in CI, and at pre-publish time. Edit this file to change the contract \u2014 never to paper over a client that drifted.",
  "contractVersion": "1.0.0",
  "product": "fiducia",
  "provenance": {
    "source": "operations.json",
    "sourceSha256": "39bd860c38ff1490ea52ae359c3caf56ce7972bb9429422a23d231cbe35d2e80",
    "sourceKind": "operations-manifest",
    "generatedBy": "contract/bin/derive_contract.py",
    "generatedAt": "2026-08-23",
    "enrichedFromClients": 12
  },
  "conventions": {
    "clientType": "FiduciaClient",
    "errorTypes": [
      "FiduciaError"
    ],
    "naming": {
      "default": "snake_case",
      "byLanguage": {
        "c": "snake_case",
        "clojure": "kebab-case",
        "cpp": "snake_case",
        "crystal": "snake_case",
        "csharp": "PascalCase",
        "dart": "camelCase",
        "elixir": "snake_case",
        "erlang": "snake_case",
        "fsharp": "PascalCase",
        "gleam": "snake_case",
        "go": "PascalCase",
        "haskell": "camelCase",
        "java": "camelCase",
        "julia": "snake_case",
        "kotlin": "camelCase",
        "lua": "snake_case",
        "matlab": "snake_case",
        "nim": "camelCase",
        "ocaml": "snake_case",
        "php": "camelCase",
        "powershell": "PascalCase",
        "python": "snake_case",
        "r": "snake_case",
        "ruby": "snake_case",
        "rust": "snake_case",
        "rust-wasm": "snake_case",
        "scala": "camelCase",
        "shell": "snake_case",
        "swift": "camelCase",
        "ts": "camelCase",
        "zig": "camelCase"
      }
    }
  },
  "interfaceSchemas": [
    {
      "name": "Barriers",
      "vendoredPath": "contract/schemas/barriers.schema.json",
      "upstreamRepo": "fiducia-interfaces",
      "upstreamPath": "schema/barriers.schema.json",
      "sha256": "c0a923470d96169cbf671dd4acc9bfd47d181acfcddc6cc60411fd8a86435d6a"
    },
    {
      "name": "Budgets",
      "vendoredPath": "contract/schemas/budgets.schema.json",
      "upstreamRepo": "fiducia-interfaces",
      "upstreamPath": "schema/budgets.schema.json",
      "sha256": "6cf2ab2789b3deb0d44b02a0dfab9f800ea6247ca0da4b2685969e764abcf10f"
    },
    {
      "name": "Claims",
      "vendoredPath": "contract/schemas/claims.schema.json",
      "upstreamRepo": "fiducia-interfaces",
      "upstreamPath": "schema/claims.schema.json",
      "sha256": "30fb004a42d9d96fb347dda95e8a3401daf538ae521eb5b5f38fa4e589e5523c"
    },
    {
      "name": "Common",
      "vendoredPath": "contract/schemas/common.schema.json",
      "upstreamRepo": "fiducia-interfaces",
      "upstreamPath": "schema/common.schema.json",
      "sha256": "733f5b36ed27173668069740e2da8edf281853f511f816463d1118bb3ff0535e"
    },
    {
      "name": "Counters",
      "vendoredPath": "contract/schemas/counters.schema.json",
      "upstreamRepo": "fiducia-interfaces",
      "upstreamPath": "schema/counters.schema.json",
      "sha256": "469834f2a6ce004d11574ebd8a566824f3b16c38f9f860d3e42588178b67134a"
    },
    {
      "name": "Decisions",
      "vendoredPath": "contract/schemas/decisions.schema.json",
      "upstreamRepo": "fiducia-interfaces",
      "upstreamPath": "schema/decisions.schema.json",
      "sha256": "a0c1bfcd9aa1cf657dd28d08c095aad63f8f1363c89ea7f2447cb32c4be8e2ed"
    },
    {
      "name": "Discovery",
      "vendoredPath": "contract/schemas/discovery.schema.json",
      "upstreamRepo": "fiducia-interfaces",
      "upstreamPath": "schema/discovery.schema.json",
      "sha256": "08527156aca8aa0036d890307b7df25927d8f5441c89bada3317df28bd0f72b2"
    },
    {
      "name": "Effects",
      "vendoredPath": "contract/schemas/effects.schema.json",
      "upstreamRepo": "fiducia-interfaces",
      "upstreamPath": "schema/effects.schema.json",
      "sha256": "4f090360911e723e8b895229bbba1ab2be0feb03161dc49356db785c83ecca08"
    },
    {
      "name": "Elections",
      "vendoredPath": "contract/schemas/elections.schema.json",
      "upstreamRepo": "fiducia-interfaces",
      "upstreamPath": "schema/elections.schema.json",
      "sha256": "686bb50bdc90decb133c7372f3c29b6c5e430c120a70ebfe11cb78d38ba2a586"
    },
    {
      "name": "Handoffs",
      "vendoredPath": "contract/schemas/handoffs.schema.json",
      "upstreamRepo": "fiducia-interfaces",
      "upstreamPath": "schema/handoffs.schema.json",
      "sha256": "641e1ab4b8cd4cd8533db601d0292bb4a31b8b05dba99bacd98baecf2711695b"
    },
    {
      "name": "Idempotency",
      "vendoredPath": "contract/schemas/idempotency.schema.json",
      "upstreamRepo": "fiducia-interfaces",
      "upstreamPath": "schema/idempotency.schema.json",
      "sha256": "a4fe54471c74951789feb78c642f92c35cf7ad8b5cdc2197446f6d8ded5d37b1"
    },
    {
      "name": "Kv",
      "vendoredPath": "contract/schemas/kv.schema.json",
      "upstreamRepo": "fiducia-interfaces",
      "upstreamPath": "schema/kv.schema.json",
      "sha256": "5da393cdd91148b185c9bc2e398013478bc83b9b5576144a90234309405d13a8"
    },
    {
      "name": "Locks",
      "vendoredPath": "contract/schemas/locks.schema.json",
      "upstreamRepo": "fiducia-interfaces",
      "upstreamPath": "schema/locks.schema.json",
      "sha256": "da14eb232fe84404eb290490d15718b7598e8dc6d95f6806b5a6715c9a9ec6dd"
    },
    {
      "name": "RateLimits",
      "vendoredPath": "contract/schemas/rate_limits.schema.json",
      "upstreamRepo": "fiducia-interfaces",
      "upstreamPath": "schema/rate_limits.schema.json",
      "sha256": "fbaf919bc7d05be0d476f116586e5e2f9b171ac9d924a46ecc3da952e54dfec5"
    },
    {
      "name": "Schedules",
      "vendoredPath": "contract/schemas/schedules.schema.json",
      "upstreamRepo": "fiducia-interfaces",
      "upstreamPath": "schema/schedules.schema.json",
      "sha256": "766a0f75b269f4bb7461b2d1550d6bd03fe81368f065c4a006b140b600f485e7"
    },
    {
      "name": "Sync",
      "vendoredPath": "contract/schemas/sync.schema.json",
      "upstreamRepo": "fiducia-interfaces",
      "upstreamPath": "schema/sync.schema.json",
      "sha256": "13413f413cbed14d090687d6d9927f7fc439fdfdeddec3cfe2ba5486ee360652"
    },
    {
      "name": "Tasks",
      "vendoredPath": "contract/schemas/tasks.schema.json",
      "upstreamRepo": "fiducia-interfaces",
      "upstreamPath": "schema/tasks.schema.json",
      "sha256": "26669c33c7e9eebd49e3a1d884750b0c3a47fde93bd8c1e80c94772bc64310d9"
    }
  ],
  "types": {
    "Barriers": {
      "$ref": "./schemas/barriers.schema.json"
    },
    "Budgets": {
      "$ref": "./schemas/budgets.schema.json"
    },
    "Claims": {
      "$ref": "./schemas/claims.schema.json"
    },
    "Common": {
      "$ref": "./schemas/common.schema.json"
    },
    "Counters": {
      "$ref": "./schemas/counters.schema.json"
    },
    "Decisions": {
      "$ref": "./schemas/decisions.schema.json"
    },
    "Discovery": {
      "$ref": "./schemas/discovery.schema.json"
    },
    "Effects": {
      "$ref": "./schemas/effects.schema.json"
    },
    "Elections": {
      "$ref": "./schemas/elections.schema.json"
    },
    "Handoffs": {
      "$ref": "./schemas/handoffs.schema.json"
    },
    "Idempotency": {
      "$ref": "./schemas/idempotency.schema.json"
    },
    "Kv": {
      "$ref": "./schemas/kv.schema.json"
    },
    "Locks": {
      "$ref": "./schemas/locks.schema.json"
    },
    "RateLimits": {
      "$ref": "./schemas/rate_limits.schema.json"
    },
    "Schedules": {
      "$ref": "./schemas/schedules.schema.json"
    },
    "Sync": {
      "$ref": "./schemas/sync.schema.json"
    },
    "Tasks": {
      "$ref": "./schemas/tasks.schema.json"
    }
  },
  "operations": [
    {
      "name": "barrier_arrive",
      "group": "barriers",
      "doc": "Record a participant's arrival or veto; repeat arrivals by the same participant are idempotent.",
      "http": {
        "method": "POST",
        "path": "/v1/barriers/arrive"
      },
      "params": [
        {
          "name": "name",
          "in": "body",
          "type": "string",
          "required": true
        },
        {
          "name": "participant",
          "in": "body",
          "type": "string",
          "required": true
        },
        {
          "name": "weight",
          "in": "body",
          "type": "int",
          "required": false
        },
        {
          "name": "veto",
          "in": "body",
          "type": "bool",
          "required": false
        }
      ],
      "returns": {
        "type": "object"
      }
    },
    {
      "name": "barrier_create",
      "group": "barriers",
      "doc": "Create a fan-in barrier with a resolution policy (all/quorum/first_success/any_veto/best_by_deadline/weighted_quorum).",
      "http": {
        "method": "POST",
        "path": "/v1/barriers/create"
      },
      "params": [
        {
          "name": "name",
          "in": "body",
          "type": "string",
          "required": true
        },
        {
          "name": "policy",
          "in": "body",
          "type": "object",
          "required": true
        },
        {
          "name": "expected",
          "in": "body",
          "type": "int",
          "required": false
        },
        {
          "name": "deadline_ms",
          "in": "body",
          "type": "int",
          "required": false
        }
      ],
      "returns": {
        "type": "object"
      }
    },
    {
      "name": "barrier_get",
      "group": "barriers",
      "doc": "Read a barrier's arrivals and resolution status; absent reads as found=false.",
      "http": {
        "method": "GET",
        "path": "/v1/barriers"
      },
      "params": [
        {
          "name": "name",
          "in": "query",
          "type": "string",
          "required": true
        }
      ],
      "returns": {